{
  "schema_version": "1.0",
  "ip_id": "demon-slayer-infinity-castle",
  "title": "Demon Slayer: Kimetsu no Yaiba - The Movie: Infinity Castle",
  "experiment_id": "regional-dubbing-test",
  "simulation_status": "completed",
  "engine": "sakura-abm",
  "engine_version": "0.1.0",
  "data_label_legend": {
    "observed": "figure/report taken from a cited public source",
    "inferred": "derived from cited sources by interpretation",
    "simulated": "produced by this simulation under stated assumptions",
    "unknown": "not known"
  },
  "scenarios": [
    {
      "id": "baseline-subs-only",
      "label": "Baseline: Japanese + English (subbed) availability",
      "description": "Counterfactual control: original Japanese with English subtitles/availability only. Did not occur as such in reality (the actual release included regional dubs); used to isolate the language factor.",
      "counterfactual": true,
      "languages_available": [
        "ja",
        "en"
      ],
      "marketing_reach": {
        "streaming": 1.0,
        "social": 1.0,
        "theatrical": 1.0,
        "search": 1.0,
        "tv": 1.0
      },
      "seed": 42,
      "data_label": "simulated",
      "totals": {
        "reach": 22,
        "reach_rate": 0.55,
        "viewed": 20,
        "view_rate": 0.5,
        "engaged": 15,
        "engagement_rate": 0.375,
        "shares_total": 17,
        "discussions_total": 18,
        "shares_per_agent": 0.425,
        "data_label": "simulated"
      },
      "per_round": [
        {
          "round": 0,
          "actions": {
            "discover": 10,
            "view_info": 8,
            "express_interest": 2,
            "share": 1,
            "discuss": 0,
            "ignore": 30
          },
          "cumulative_aware": 10,
          "cumulative_viewed": 8,
          "cumulative_engaged": 2,
          "avg_wom_exposure": 0.01978
        },
        {
          "round": 1,
          "actions": {
            "discover": 2,
            "view_info": 3,
            "express_interest": 6,
            "share": 2,
            "discuss": 4,
            "ignore": 33
          },
          "cumulative_aware": 12,
          "cumulative_viewed": 11,
          "cumulative_engaged": 8,
          "avg_wom_exposure": 0.121736
        },
        {
          "round": 2,
          "actions": {
            "discover": 3,
            "view_info": 2,
            "express_interest": 2,
            "share": 3,
            "discuss": 1,
            "ignore": 34
          },
          "cumulative_aware": 15,
          "cumulative_viewed": 13,
          "cumulative_engaged": 10,
          "avg_wom_exposure": 0.161409
        },
        {
          "round": 3,
          "actions": {
            "discover": 3,
            "view_info": 3,
            "express_interest": 1,
            "share": 3,
            "discuss": 4,
            "ignore": 30
          },
          "cumulative_aware": 18,
          "cumulative_viewed": 16,
          "cumulative_engaged": 11,
          "avg_wom_exposure": 0.169222
        },
        {
          "round": 4,
          "actions": {
            "discover": 2,
            "view_info": 2,
            "express_interest": 2,
            "share": 3,
            "discuss": 5,
            "ignore": 27
          },
          "cumulative_aware": 20,
          "cumulative_viewed": 18,
          "cumulative_engaged": 13,
          "avg_wom_exposure": 0.216576
        },
        {
          "round": 5,
          "actions": {
            "discover": 2,
            "view_info": 2,
            "express_interest": 2,
            "share": 5,
            "discuss": 4,
            "ignore": 31
          },
          "cumulative_aware": 22,
          "cumulative_viewed": 20,
          "cumulative_engaged": 15,
          "avg_wom_exposure": 0.242692
        }
      ],
      "per_segment": {
        "mainstream-anime-fans": {
          "population": 14,
          "reach": 10,
          "engaged": 10,
          "reach_rate": 0.714286,
          "engagement_rate": 0.714286
        },
        "regional-language-first": {
          "population": 8,
          "reach": 3,
          "engaged": 1,
          "reach_rate": 0.375,
          "engagement_rate": 0.125
        },
        "manga-first-readers": {
          "population": 3,
          "reach": 2,
          "engaged": 2,
          "reach_rate": 0.666667,
          "engagement_rate": 0.666667
        },
        "casual-streaming-viewers": {
          "population": 7,
          "reach": 4,
          "engaged": 2,
          "reach_rate": 0.571429,
          "engagement_rate": 0.285714
        },
        "film-event-audiences": {
          "population": 8,
          "reach": 3,
          "engaged": 0,
          "reach_rate": 0.375,
          "engagement_rate": 0.0
        }
      },
      "per_language": {
        "en": {
          "reach": 9,
          "engaged": 5,
          "engagement_rate": 0.555556
        },
        "hi": {
          "reach": 6,
          "engaged": 5,
          "engagement_rate": 0.833333
        },
        "ja": {
          "reach": 4,
          "engaged": 3,
          "engagement_rate": 0.75
        },
        "ta": {
          "reach": 0,
          "engaged": 0,
          "engagement_rate": 0.0
        },
        "te": {
          "reach": 3,
          "engaged": 2,
          "engagement_rate": 0.666667
        }
      },
      "graph": {
        "nodes": 40,
        "edges": 111,
        "degree_m": 3
      },
      "duration_ms": 1,
      "variability": {
        "repetitions": 5,
        "seeds": [
          42,
          43,
          44,
          45,
          46
        ],
        "engagement_rate": {
          "mean": 0.49,
          "std": 0.083066,
          "min": 0.375,
          "max": 0.625
        },
        "reach_rate": {
          "mean": 0.685,
          "std": 0.100747,
          "min": 0.55,
          "max": 0.85
        },
        "shares_total": {
          "mean": 17.0,
          "std": 4.816638,
          "min": 12,
          "max": 26
        },
        "data_label": "simulated"
      }
    },
    {
      "id": "regional-dub",
      "label": "Regional-language strategy: + Hindi, Tamil, Telugu dubs",
      "description": "Mirrors the observed release strategy: Hindi/Tamil/Telugu dubs added on top of the baseline (the actual Infinity Castle India release carried Japanese, Hindi, Tamil and Telugu).",
      "counterfactual": false,
      "languages_available": [
        "ja",
        "en",
        "hi",
        "ta",
        "te"
      ],
      "marketing_reach": {
        "streaming": 1.0,
        "social": 1.0,
        "theatrical": 1.0,
        "search": 1.0,
        "tv": 1.0
      },
      "seed": 42,
      "data_label": "simulated",
      "totals": {
        "reach": 24,
        "reach_rate": 0.6,
        "viewed": 23,
        "view_rate": 0.575,
        "engaged": 18,
        "engagement_rate": 0.45,
        "shares_total": 20,
        "discussions_total": 27,
        "shares_per_agent": 0.5,
        "data_label": "simulated"
      },
      "per_round": [
        {
          "round": 0,
          "actions": {
            "discover": 11,
            "view_info": 8,
            "express_interest": 3,
            "share": 2,
            "discuss": 1,
            "ignore": 29
          },
          "cumulative_aware": 11,
          "cumulative_viewed": 8,
          "cumulative_engaged": 3,
          "avg_wom_exposure": 0.027593
        },
        {
          "round": 1,
          "actions": {
            "discover": 3,
            "view_info": 4,
            "express_interest": 6,
            "share": 3,
            "discuss": 5,
            "ignore": 31
          },
          "cumulative_aware": 14,
          "cumulative_viewed": 12,
          "cumulative_engaged": 9,
          "avg_wom_exposure": 0.129549
        },
        {
          "round": 2,
          "actions": {
            "discover": 3,
            "view_info": 3,
            "express_interest": 2,
            "share": 3,
            "discuss": 2,
            "ignore": 32
          },
          "cumulative_aware": 17,
          "cumulative_viewed": 15,
          "cumulative_engaged": 11,
          "avg_wom_exposure": 0.169222
        },
        {
          "round": 3,
          "actions": {
            "discover": 4,
            "view_info": 4,
            "express_interest": 1,
            "share": 3,
            "discuss": 6,
            "ignore": 27
          },
          "cumulative_aware": 21,
          "cumulative_viewed": 19,
          "cumulative_engaged": 12,
          "avg_wom_exposure": 0.18052
        },
        {
          "round": 4,
          "actions": {
            "discover": 1,
            "view_info": 2,
            "express_interest": 5,
            "share": 4,
            "discuss": 5,
            "ignore": 25
          },
          "cumulative_aware": 22,
          "cumulative_viewed": 21,
          "cumulative_engaged": 17,
          "avg_wom_exposure": 0.274526
        },
        {
          "round": 5,
          "actions": {
            "discover": 2,
            "view_info": 2,
            "express_interest": 1,
            "share": 5,
            "discuss": 8,
            "ignore": 28
          },
          "cumulative_aware": 24,
          "cumulative_viewed": 23,
          "cumulative_engaged": 18,
          "avg_wom_exposure": 0.289333
        }
      ],
      "per_segment": {
        "mainstream-anime-fans": {
          "population": 14,
          "reach": 10,
          "engaged": 10,
          "reach_rate": 0.714286,
          "engagement_rate": 0.714286
        },
        "regional-language-first": {
          "population": 8,
          "reach": 4,
          "engaged": 3,
          "reach_rate": 0.5,
          "engagement_rate": 0.375
        },
        "manga-first-readers": {
          "population": 3,
          "reach": 2,
          "engaged": 2,
          "reach_rate": 0.666667,